{
  "ci_status": "pending_external_ci",
  "final_project_complete": false,
  "formal_quality_status": "incomplete",
  "frozen_hashes_ready": false,
  "gate_a_offline_validation_ready": true,
  "gate_b_execution_allowed": false,
  "implementation_draft_pr_status": "pending_external_delivery",
  "model_quality_status": "not_measured",
  "production_ready": false,
  "remaining_gate_b_blockers": [
    "missing:authorization_id",
    "missing:canonical_authorization_sha256",
    "missing:frozen_source_tree_sha256",
    "missing:frozen_executable_source_sha256",
    "missing:frozen_runtime_image_sha256",
    "missing:frozen_deployment_sha256",
    "missing:frozen_runtime_identity_sha256",
    "missing:organization_id",
    "missing:participant_stable_ids",
    "missing:participant_roles",
    "missing:participant_consent_receipt_sha256",
    "missing:repository_allowlist",
    "missing:allowed_base_branch_rule",
    "missing:pr_selection_window_start_utc",
    "missing:pr_selection_window_end_utc",
    "missing:deterministic_selection_rule",
    "missing:deterministic_selection_seed_sha256",
    "missing:selected_pr_count",
    "missing:max_repair_findings_per_pr",
    "missing:max_repair_jobs",
    "missing:max_real_branches",
    "missing:max_real_commits",
    "missing:max_real_pushes",
    "missing:max_real_draft_repair_prs",
    "missing:github_app_installation_id",
    "missing:github_repository_scopes",
    "missing:provider_model_snapshot",
    "missing:provider_endpoint_allowlist",
    "missing:max_logical_calls",
    "missing:max_http_attempts",
    "missing:max_input_tokens",
    "missing:max_output_tokens",
    "missing:max_cached_tokens",
    "missing:max_micro_cny",
    "missing:max_wall_clock_seconds",
    "missing:data_classification",
    "missing:provider_sendable_code_scope",
    "missing:raw_content_retention_days",
    "missing:metadata_retention_days",
    "missing:feedback_retention_days",
    "missing:deletion_owner_process",
    "missing:incident_owner",
    "missing:kill_switch",
    "missing:credential_delivery_mode",
    "missing:credential_fingerprint_sha256",
    "missing:credential_revoke_procedure",
    "missing:human_approval_sla_seconds",
    "missing:business_success_thresholds",
    "missing:safety_stop_thresholds",
    "missing:cost_stop_thresholds",
    "permission_not_granted:allow_real_provider_calls",
    "permission_not_granted:allow_real_github_repair_branch_push",
    "permission_not_granted:allow_real_draft_repair_pr",
    "exact_approval_text_missing"
  ],
  "report_id": "phase11d-gate-a-synthetic-acceptance",
  "schema_version": "crag.phase11d.acceptance/v1alpha1"
}
